{
  "id": "openrouter-gemini-4-argon",
  "provider": "openrouter",
  "model": "google/gemini-4-argon",
  "description": "Google: Gemini 4 Argon via OpenRouter. Gemini 4 Argon is Google's flagship reasoning model, built for complex software engineering, deep mathematical and scientific problem solving, and autonomous multi-step agents. Google trained it to keep context across",
  "strengths": [
    "coding",
    "reasoning",
    "multimodal",
    "long_context",
    "ui_frontend"
  ],
  "weaknesses": [
    "pricey_output"
  ],
  "skills": {
    "coding": {
      "theta": 8.7,
      "se": 0.9
    },
    "debugging": {
      "theta": 8.5,
      "se": 0.9
    },
    "reasoning": {
      "theta": 8.6,
      "se": 0.9
    },
    "math": {
      "theta": 8.5,
      "se": 0.9
    },
    "writing": {
      "theta": 8.4,
      "se": 0.9
    },
    "research": {
      "theta": 8.5,
      "se": 0.9
    },
    "review": {
      "theta": 8.5,
      "se": 0.9
    },
    "planning": {
      "theta": 8.5,
      "se": 0.9
    },
    "ui_frontend": {
      "theta": 8.7,
      "se": 0.9
    },
    "data_analysis": {
      "theta": 8.6,
      "se": 0.9
    }
  },
  "discrimination": 1.2,
  "modalities": {
    "input": [
      "audio",
      "image",
      "text",
      "video"
    ],
    "output": [
      "text"
    ]
  },
  "features": {
    "tools": true,
    "json_mode": true
  },
  "limits": {
    "context_tokens": 1048576,
    "max_output_tokens": 943718
  },
  "cost": {
    "input_per_mtok": 2.0,
    "output_per_mtok": 10.0,
    "currency": "USD",
    "cached_input_per_mtok": 0.1
  },
  "latency": {
    "ttft_ms_p50": 2500,
    "tokens_per_sec": 80
  },
  "local": false,
  "tags": [
    "harness:openrouter",
    "tier:frontier"
  ],
  "card_version": "2026-10-25",
  "provenance": "benchmark-informed",
  "field_provenance": {
    "cost": "verified",
    "limits": "verified",
    "skills": "benchmark-informed",
    "latency": "estimated"
  },
  "sources": [
    "https://openrouter.ai/api/v1/models",
    "https://openrouter.ai/rankings",
    "https://openrouter.ai/api/v1/models (benchmarks.artificial_analysis, Artificial Analysis indices)"
  ],
  "notes": "AA intelligence 52.6 (no coding index); alongside gpt-6.1-sol and below opus/sonnet-5.5 by AA. Prices are OpenRouter list prices (per-token x 1e6) from /api/v1/models on 2026-10-25; they can differ per upstream provider. Context/max output are the top provider values. Latency is estimated: OpenRouter exposes no latency/throughput stats in the public API. Non-coding skill axes derived from coding theta with fixed offsets (tweaked per model), not measured."
}
