{
  "id": "openrouter-gemini-3.8-flash",
  "provider": "openrouter",
  "model": "google/gemini-3.8-flash",
  "description": "Google: Gemini 3.8 Flash via OpenRouter. Gemini 3.8 Flash is Google's most intelligent Flash model with significant gains from 3.7 Flash across software engineering, agentic tasks, and multi-step reasoning.",
  "strengths": [
    "coding",
    "multimodal",
    "long_context",
    "fast"
  ],
  "weaknesses": [
    "agentic"
  ],
  "skills": {
    "coding": {
      "theta": 8.0,
      "se": 0.8
    },
    "debugging": {
      "theta": 7.8,
      "se": 0.8
    },
    "reasoning": {
      "theta": 6.99,
      "se": 0.56
    },
    "math": {
      "theta": 7.8,
      "se": 0.8
    },
    "writing": {
      "theta": 7.7,
      "se": 0.8
    },
    "research": {
      "theta": 7.8,
      "se": 0.8
    },
    "review": {
      "theta": 7.8,
      "se": 0.8
    },
    "planning": {
      "theta": 6.46,
      "se": 0.62
    },
    "ui_frontend": {
      "theta": 8.0,
      "se": 0.8
    },
    "data_analysis": {
      "theta": 6.92,
      "se": 0.6
    }
  },
  "discrimination": 1.2,
  "modalities": {
    "input": [
      "text",
      "image",
      "video",
      "audio"
    ],
    "output": [
      "text"
    ]
  },
  "features": {
    "tools": true,
    "json_mode": true
  },
  "limits": {
    "context_tokens": 1048576,
    "max_output_tokens": 65536
  },
  "cost": {
    "input_per_mtok": 0.825,
    "output_per_mtok": 4.125,
    "currency": "USD",
    "cached_input_per_mtok": 0.0825
  },
  "latency": {
    "ttft_ms_p50": 800,
    "tokens_per_sec": 150
  },
  "local": false,
  "tags": [
    "harness:openrouter",
    "tier:strong"
  ],
  "card_version": "2026-10-26",
  "provenance": "benchmark-informed",
  "field_provenance": {
    "cost": "verified",
    "limits": "verified",
    "skills": "benchmark-informed",
    "latency": "estimated"
  },
  "sources": [
    "https://openrouter.ai/api/v1/models",
    "https://openrouter.ai/rankings",
    "https://openrouter.ai/api/v1/models (benchmarks.artificial_analysis, Artificial Analysis indices)",
    "data/outcomes/REPORT_attempts.md (attempt-and-grade IRT; judge deepseek-v4.1-flash validated vs kimi-k3.1-pro)"
  ],
  "notes": "AA coding 76.3 (high), intelligence 40.9, agentic 40.2; coding index suggests 8.3, II suggests 7.6; averaged. Prices are OpenRouter list prices (per-token x 1e6) from /api/v1/models on 2026-10-25; they can differ per upstream provider. Context/max output are the top provider values. Latency is estimated: OpenRouter exposes no latency/throughput stats in the public API. Non-coding skill axes derived from coding theta with fixed offsets (tweaked per model), not measured. verified (attempt-grade 2026-10): axes data_analysis 7.7->6.92, planning 7.8->6.46, reasoning 7.9->6.99 fitted (1PL IRT, router scale) from single-turn, no-tool attempts on non-SWE tasks, graded by deepseek-v4.1-flash (kappa 0.85 vs kimi-k3.1-pro); applied only where the direction also holds under gpt-6.1-sol grading. Location anchored on the 5 attempters' own card means (deltas are relative to their consensus). Other axes and supersedes unchanged. See data/outcomes/REPORT_attempts.md."
}
