{
  "id": "openrouter-hy3",
  "provider": "openrouter",
  "model": "tencent/hy3",
  "description": "Tencent: Hy3 via OpenRouter. Hy3 is a 295B-parameter Mixture-of-Experts model from Tencent (21B active, 192 experts with top-8 routing) built for reasoning, agentic workflows, and real-world production use. It supports a configurable reasoning effort:",
  "strengths": [
    "cheap_for_tier"
  ],
  "weaknesses": [
    "unproven",
    "vision"
  ],
  "skills": {
    "coding": {
      "theta": 6.5,
      "se": 1.6
    },
    "debugging": {
      "theta": 6.3,
      "se": 1.6
    },
    "reasoning": {
      "theta": 6.4,
      "se": 1.6
    },
    "math": {
      "theta": 6.3,
      "se": 1.6
    },
    "writing": {
      "theta": 6.2,
      "se": 1.6
    },
    "research": {
      "theta": 6.1,
      "se": 1.6
    },
    "review": {
      "theta": 6.3,
      "se": 1.6
    },
    "planning": {
      "theta": 6.3,
      "se": 1.6
    },
    "ui_frontend": {
      "theta": 6.3,
      "se": 1.6
    },
    "data_analysis": {
      "theta": 6.2,
      "se": 1.6
    }
  },
  "discrimination": 1.2,
  "modalities": {
    "input": [
      "text"
    ],
    "output": [
      "text"
    ]
  },
  "features": {
    "tools": true,
    "json_mode": true
  },
  "limits": {
    "context_tokens": 262144,
    "max_output_tokens": 128000
  },
  "cost": {
    "input_per_mtok": 0.132,
    "output_per_mtok": 0.528,
    "currency": "USD",
    "cached_input_per_mtok": 0.033
  },
  "latency": {
    "ttft_ms_p50": 1500,
    "tokens_per_sec": 80
  },
  "local": false,
  "tags": [
    "harness:openrouter",
    "tier:small"
  ],
  "card_version": "2026-10-25",
  "provenance": "estimated",
  "field_provenance": {
    "cost": "verified",
    "limits": "verified",
    "skills": "estimated",
    "latency": "estimated"
  },
  "sources": [
    "https://openrouter.ai/api/v1/models",
    "https://openrouter.ai/rankings"
  ],
  "notes": "No AA benchmarks found. Conservative guess from price tier. Prices are OpenRouter list prices (per-token x 1e6) from /api/v1/models on 2026-10-25; they can differ per upstream provider. Context/max output are the top provider values. Latency is estimated: OpenRouter exposes no latency/throughput stats in the public API. Non-coding skill axes derived from coding theta with fixed offsets (tweaked per model), not measured."
}
