{
  "id": "ollama-qwen3.5-9b",
  "provider": "ollama",
  "model": "qwen3.5:9b",
  "description": "Qwen3.5 9B vision-language model via Ollama (also the 'latest' tag): laptop-size local model for simple edits and chat.",
  "strengths": [
    "free",
    "private",
    "offline",
    "multimodal",
    "low_ram"
  ],
  "weaknesses": [
    "hard_reasoning",
    "complex_coding",
    "long_horizon_agentic"
  ],
  "skills": {
    "coding": {
      "theta": 4.8,
      "se": 1.5
    },
    "debugging": {
      "theta": 4.4,
      "se": 1.5
    },
    "reasoning": {
      "theta": 5.1,
      "se": 1.5
    },
    "math": {
      "theta": 4.9,
      "se": 1.5
    },
    "writing": {
      "theta": 5.2,
      "se": 1.5
    },
    "research": {
      "theta": 4.2,
      "se": 1.5
    },
    "review": {
      "theta": 4.6,
      "se": 1.5
    },
    "planning": {
      "theta": 4.6,
      "se": 1.5
    },
    "ui_frontend": {
      "theta": 4.6,
      "se": 1.5
    },
    "data_analysis": {
      "theta": 4.6,
      "se": 1.5
    }
  },
  "discrimination": 1.2,
  "modalities": {
    "input": [
      "text",
      "image"
    ],
    "output": [
      "text"
    ]
  },
  "features": {
    "tools": true,
    "json_mode": true
  },
  "limits": {
    "context_tokens": 131072,
    "max_output_tokens": 32768
  },
  "cost": {
    "input_per_mtok": 0.0,
    "output_per_mtok": 0.0,
    "currency": "USD"
  },
  "latency": {
    "ttft_ms_p50": 250,
    "tokens_per_sec": 33
  },
  "local": true,
  "tags": [
    "harness:ollama",
    "tier:small",
    "local",
    "open_weights",
    "not-installed",
    "size:small",
    "vision",
    "thinking"
  ],
  "card_version": "2026-10-25",
  "provenance": "estimated",
  "field_provenance": {
    "cost": "verified",
    "limits": "estimated",
    "skills": "estimated",
    "latency": "estimated"
  },
  "sources": [
    "https://ollama.com/library/qwen3.5:9b",
    "https://ollama.com/library/qwen3.5/tags"
  ],
  "notes": "NOT INSTALLED: pull with `ollama pull qwen3.5:9b`. Download 6.6GB (8.95B dense, Q4_K_M default tag), needs ~9GB RAM plus KV cache; fits the 48GB M4 Max. Library context 256K; limit set to 131072 because Ollama sizes context from VRAM (assumes OLLAMA_CONTEXT_LENGTH raised). No independent benchmark found; slightly below gemma4:26b (5.0) for coding, better at reasoning with thinking on. Q4 quantization already accounted for. Latency estimated for M4 Max 48GB by scaling measured gemma4:26b (78 tok/s, ~4B active) by active-weight bytes; not measured. Thinking is on by default: pass think=false for fast answers. Default 'latest' tag is this 9b. Page checked 2026-10-25."
}
