{
  "id": "openrouter-grok-4.7",
  "provider": "openrouter",
  "model": "x-ai/grok-4.7",
  "description": "SpaceXAI: Grok 4.7 via OpenRouter. Grok 4.7 is SpaceXAI's flagship model for coding, agentic tasks, and knowledge work, succeeding Grok 4.6. It is particularly strong at long-running software engineering tasks, verifying its own work, and",
  "strengths": [
    "coding",
    "reasoning",
    "long_context",
    "vision"
  ],
  "weaknesses": [
    "ui_polish"
  ],
  "skills": {
    "coding": {
      "theta": 8.5,
      "se": 0.9
    },
    "debugging": {
      "theta": 8.3,
      "se": 0.9
    },
    "reasoning": {
      "theta": 8.4,
      "se": 0.9
    },
    "math": {
      "theta": 8.5,
      "se": 0.9
    },
    "writing": {
      "theta": 8.2,
      "se": 0.9
    },
    "research": {
      "theta": 8.1,
      "se": 0.9
    },
    "review": {
      "theta": 8.3,
      "se": 0.9
    },
    "planning": {
      "theta": 8.3,
      "se": 0.9
    },
    "ui_frontend": {
      "theta": 8.3,
      "se": 0.9
    },
    "data_analysis": {
      "theta": 8.2,
      "se": 0.9
    }
  },
  "discrimination": 1.2,
  "modalities": {
    "input": [
      "text",
      "image"
    ],
    "output": [
      "text"
    ]
  },
  "features": {
    "tools": true,
    "json_mode": true
  },
  "limits": {
    "context_tokens": 500000,
    "max_output_tokens": 450000
  },
  "cost": {
    "input_per_mtok": 2.0,
    "output_per_mtok": 6.0,
    "currency": "USD",
    "cached_input_per_mtok": 0.5
  },
  "latency": {
    "ttft_ms_p50": 2000,
    "tokens_per_sec": 80
  },
  "local": false,
  "tags": [
    "harness:openrouter",
    "tier:strong"
  ],
  "card_version": "2026-10-25",
  "provenance": "benchmark-informed",
  "field_provenance": {
    "cost": "verified",
    "limits": "verified",
    "skills": "benchmark-informed",
    "latency": "estimated"
  },
  "sources": [
    "https://openrouter.ai/api/v1/models",
    "https://openrouter.ai/rankings",
    "https://openrouter.ai/api/v1/models (benchmarks.artificial_analysis, Artificial Analysis indices)"
  ],
  "notes": "AA intelligence 46.4 (no coding index); successor to grok-4.6 (44.3, CI 76.8 -> 8.4). 500k context. Prices are OpenRouter list prices (per-token x 1e6) from /api/v1/models on 2026-10-25; they can differ per upstream provider. Context/max output are the top provider values. Latency is estimated: OpenRouter exposes no latency/throughput stats in the public API. Non-coding skill axes derived from coding theta with fixed offsets (tweaked per model), not measured."
}
