{
  "id": "codex-gpt-6-luna",
  "provider": "codex",
  "model": "gpt-6-luna",
  "description": "OpenAI's most efficient GPT-6 model for focused, high-volume tasks; very cheap with surprisingly strong coding.",
  "strengths": [
    "cheap",
    "coding",
    "tool_use",
    "speed"
  ],
  "weaknesses": [
    "deep_reasoning"
  ],
  "skills": {
    "coding": {
      "theta": 7.7,
      "se": 0.8
    },
    "debugging": {
      "theta": 7.4,
      "se": 0.8
    },
    "reasoning": {
      "theta": 7.4,
      "se": 0.8
    },
    "math": {
      "theta": 7.5,
      "se": 0.8
    },
    "writing": {
      "theta": 7.0,
      "se": 0.8
    },
    "research": {
      "theta": 7.0,
      "se": 0.8
    },
    "review": {
      "theta": 7.2,
      "se": 0.8
    },
    "planning": {
      "theta": 7.1,
      "se": 0.8
    },
    "ui_frontend": {
      "theta": 7.1,
      "se": 0.8
    },
    "data_analysis": {
      "theta": 7.3,
      "se": 0.8
    }
  },
  "discrimination": 1.2,
  "modalities": {
    "input": [
      "text",
      "image"
    ],
    "output": [
      "text"
    ]
  },
  "features": {
    "tools": true,
    "json_mode": true,
    "reasoning_effort": [
      "none",
      "low",
      "medium",
      "high",
      "xhigh",
      "max"
    ]
  },
  "limits": {
    "context_tokens": 1050000,
    "max_output_tokens": 128000
  },
  "cost": {
    "input_per_mtok": 0.1,
    "output_per_mtok": 0.5,
    "currency": "USD",
    "cached_input_per_mtok": 0.01
  },
  "latency": {
    "ttft_ms_p50": 2000,
    "tokens_per_sec": 80
  },
  "local": false,
  "tags": [
    "harness:codex",
    "tier:mid"
  ],
  "card_version": "2026-10-25",
  "provenance": "benchmark-informed",
  "field_provenance": {
    "cost": "verified",
    "limits": "verified",
    "skills": "benchmark-informed",
    "latency": "estimated"
  },
  "sources": [
    "https://developers.openai.com/api/docs/models/gpt-6-luna",
    "https://developers.openai.com/api/docs/pricing",
    "https://atlas.kevinhu.io/benchmarks/swe-bench-verified (SWE-bench Verified, saturated >90%; used only for ordering)",
    "https://openrouter.ai/openai/gpt-6-luna"
  ],
  "notes": "Max input 922k tokens; prompts >272k tokens billed 2x input / 1.5x output."
}
