{
  "id": "openrouter-muse-spark-1.3",
  "provider": "openrouter",
  "model": "meta/muse-spark-1.3",
  "description": "Meta: Muse Spark 1.3 via OpenRouter. Muse Spark 1.3 is a multimodal reasoning model from Meta for long-running agentic, multi-agent, and coding workflows. It is designed to keep track of information across extended tasks, work through",
  "strengths": [
    "coding",
    "agentic",
    "multimodal",
    "long_context",
    "cheap_for_tier"
  ],
  "weaknesses": [
    "unproven_long_run"
  ],
  "skills": {
    "coding": {
      "theta": 8.2,
      "se": 0.7
    },
    "debugging": {
      "theta": 8.0,
      "se": 0.7
    },
    "reasoning": {
      "theta": 8.1,
      "se": 0.7
    },
    "math": {
      "theta": 8.0,
      "se": 0.7
    },
    "writing": {
      "theta": 7.9,
      "se": 0.7
    },
    "research": {
      "theta": 7.8,
      "se": 0.7
    },
    "review": {
      "theta": 8.0,
      "se": 0.7
    },
    "planning": {
      "theta": 8.0,
      "se": 0.7
    },
    "ui_frontend": {
      "theta": 8.0,
      "se": 0.7
    },
    "data_analysis": {
      "theta": 7.9,
      "se": 0.7
    }
  },
  "discrimination": 1.2,
  "modalities": {
    "input": [
      "text",
      "image",
      "video"
    ],
    "output": [
      "text"
    ]
  },
  "features": {
    "tools": true,
    "json_mode": true
  },
  "limits": {
    "context_tokens": 1048576,
    "max_output_tokens": 943718
  },
  "cost": {
    "input_per_mtok": 1.25,
    "output_per_mtok": 4.25,
    "currency": "USD",
    "cached_input_per_mtok": 0.15
  },
  "latency": {
    "ttft_ms_p50": 1500,
    "tokens_per_sec": 90
  },
  "local": false,
  "tags": [
    "harness:openrouter",
    "tier:strong"
  ],
  "card_version": "2026-10-25",
  "provenance": "benchmark-informed",
  "field_provenance": {
    "cost": "verified",
    "limits": "verified",
    "skills": "benchmark-informed",
    "latency": "estimated"
  },
  "sources": [
    "https://openrouter.ai/api/v1/models",
    "https://openrouter.ai/rankings",
    "https://openrouter.ai/api/v1/models (benchmarks.artificial_analysis, Artificial Analysis indices)"
  ],
  "notes": "AA coding 75.8, intelligence 48.1, agentic 55.5; just below grok-4.6 (76.8 -> 8.4). Prices are OpenRouter list prices (per-token x 1e6) from /api/v1/models on 2026-10-25; they can differ per upstream provider. Context/max output are the top provider values. Latency is estimated: OpenRouter exposes no latency/throughput stats in the public API. Non-coding skill axes derived from coding theta with fixed offsets (tweaked per model), not measured."
}
