{
  "id": "openrouter-minimax-m3",
  "provider": "openrouter",
  "model": "minimax/minimax-m3",
  "description": "MiniMax: MiniMax M3 via OpenRouter. MiniMax-M3 is a multimodal foundation model from MiniMax. It supports text, image, and video inputs with text output, a 1M-token context window, and is suited for long-horizon agentic work, coding,",
  "strengths": [
    "cheap_for_tier",
    "long_context",
    "vision"
  ],
  "weaknesses": [
    "hard_reasoning"
  ],
  "skills": {
    "coding": {
      "theta": 7.4,
      "se": 0.54
    },
    "debugging": {
      "theta": 7.2,
      "se": 0.54
    },
    "reasoning": {
      "theta": 7.3,
      "se": 0.7
    },
    "math": {
      "theta": 7.2,
      "se": 0.7
    },
    "writing": {
      "theta": 7.1,
      "se": 0.7
    },
    "research": {
      "theta": 7.0,
      "se": 0.7
    },
    "review": {
      "theta": 7.2,
      "se": 0.7
    },
    "planning": {
      "theta": 7.2,
      "se": 0.7
    },
    "ui_frontend": {
      "theta": 7.2,
      "se": 0.7
    },
    "data_analysis": {
      "theta": 7.1,
      "se": 0.7
    }
  },
  "discrimination": 1.2,
  "modalities": {
    "input": [
      "text",
      "image",
      "video"
    ],
    "output": [
      "text"
    ]
  },
  "features": {
    "tools": true,
    "json_mode": true
  },
  "limits": {
    "context_tokens": 1048576,
    "max_output_tokens": 512000
  },
  "cost": {
    "input_per_mtok": 0.3,
    "output_per_mtok": 1.2,
    "currency": "USD",
    "cached_input_per_mtok": 0.06
  },
  "latency": {
    "ttft_ms_p50": 1500,
    "tokens_per_sec": 70
  },
  "local": false,
  "tags": [
    "harness:openrouter",
    "tier:small"
  ],
  "card_version": "2026-10-26",
  "provenance": "verified",
  "field_provenance": {
    "cost": "verified",
    "limits": "verified",
    "skills": "verified",
    "latency": "estimated"
  },
  "sources": [
    "https://openrouter.ai/api/v1/models",
    "https://openrouter.ai/rankings",
    "https://openrouter.ai/api/v1/models (benchmarks.artificial_analysis, Artificial Analysis indices)",
    "https://huggingface.co/datasets/ibragim-bad/swe_rebench_07_2026_trajectories (resolved flags only; IRT fit in data/outcomes)"
  ],
  "notes": "AA coding index 58.6, intelligence 29.2, agentic 29.5. Prices are OpenRouter list prices (per-token x 1e6) from /api/v1/models on 2026-10-25; they can differ per upstream provider. Context/max output are the top provider values. Latency is estimated: OpenRouter exposes no latency/throughput stats in the public API. Non-coding skill axes derived from coding theta with fixed offsets (tweaked per model), not measured. Outcome calibration 2026-10-26: coding fitted 7.37 +/- 0.54 on the router scale from rebench07/minimax-m3 (exact model); all axes shifted by +0.7. See data/outcomes/REPORT.md."
}
