{
  "id": "openrouter-deepseek-v4.1-flash-1017",
  "provider": "openrouter",
  "model": "deepseek/deepseek-v4.1-flash-1017",
  "description": "DeepSeek: DeepSeek V4.1 Flash 1017 via OpenRouter. DeepSeek V4.1 Flash 1017 is the October 17, 2026 snapshot of DeepSeek V4.1 Flash, served by DeepSeek under the `deepseek-flash` API model name. V4.1 Flash is a sparse mixture-of-experts model",
  "strengths": [
    "cheap_for_tier",
    "long_context",
    "high_volume"
  ],
  "weaknesses": [
    "vision_detail"
  ],
  "skills": {
    "coding": {
      "theta": 7.5,
      "se": 0.9
    },
    "debugging": {
      "theta": 7.3,
      "se": 0.9
    },
    "reasoning": {
      "theta": 7.5,
      "se": 0.9
    },
    "math": {
      "theta": 7.5,
      "se": 0.9
    },
    "writing": {
      "theta": 7.2,
      "se": 0.9
    },
    "research": {
      "theta": 7.1,
      "se": 0.9
    },
    "review": {
      "theta": 7.3,
      "se": 0.9
    },
    "planning": {
      "theta": 7.3,
      "se": 0.9
    },
    "ui_frontend": {
      "theta": 7.3,
      "se": 0.9
    },
    "data_analysis": {
      "theta": 7.2,
      "se": 0.9
    }
  },
  "discrimination": 1.2,
  "modalities": {
    "input": [
      "text",
      "image"
    ],
    "output": [
      "text"
    ]
  },
  "features": {
    "tools": true,
    "json_mode": true
  },
  "limits": {
    "context_tokens": 1048576,
    "max_output_tokens": 393216
  },
  "cost": {
    "input_per_mtok": 0.3,
    "output_per_mtok": 1.2,
    "currency": "USD",
    "cached_input_per_mtok": 0.006
  },
  "latency": {
    "ttft_ms_p50": 1500,
    "tokens_per_sec": 120
  },
  "local": false,
  "tags": [
    "harness:openrouter",
    "tier:mid",
    "open_weights"
  ],
  "card_version": "2026-10-25",
  "provenance": "benchmark-informed",
  "field_provenance": {
    "cost": "verified",
    "limits": "verified",
    "skills": "benchmark-informed",
    "latency": "estimated"
  },
  "sources": [
    "https://openrouter.ai/api/v1/models",
    "https://openrouter.ai/rankings",
    "https://openrouter.ai/api/v1/models (benchmarks.artificial_analysis, Artificial Analysis indices)"
  ],
  "notes": "Oct-17 snapshot of V4.1 Flash; most-used model on OpenRouter this week (~33T tokens/7d). Theta from AA intelligence index 39.5 (no AA coding index), mapped via anchors kimi-k3/grok-4.5. Prices are OpenRouter list prices (per-token x 1e6) from /api/v1/models on 2026-10-25; they can differ per upstream provider. Context/max output are the top provider values. Latency is estimated: OpenRouter exposes no latency/throughput stats in the public API. Non-coding skill axes derived from coding theta with fixed offsets (tweaked per model), not measured."
}
